<?xml version="1.0" encoding="UTF-8"?>
<!--Sample XML file generated by XMLSpy v2015 sp1 (http://www.altova.com)-->
<Document xmlns="http://www.six-interbank-clearing.com/de/camt.048.001.03.ch.01" xmlns:xsi="http://www.w3.org/2001/XMLSchema-instance" xsi:schemaLocation="http://www.six-interbank-clearing.com/de/camt.048.001.03.ch.01 camt.048.001.03.ch.01.xsd">
	<ModfyRsvatn>
		<MsgHdr>
			<MsgId>12349876</MsgId>
			<CreDtTm>2016-01-15T09:31:07Z</CreDtTm>
		</MsgHdr>
		<RsvatnId>
			<Cur>
				<SysId>
					<MktInfrstrctrId>
						<Prtry>CSC</Prtry>
					</MktInfrstrctrId>
				</SysId>
				<Tp>
					<Prtry>PTRES</Prtry>
				</Tp>
				<AcctOwnr>
					<FinInstnId>
						<ClrSysMmbId>
							<MmbId>092052</MmbId>
						</ClrSysMmbId>
					</FinInstnId>
				</AcctOwnr>
				<AcctId>
					<Othr>
						<Id>092050</Id>
					</Othr>
				</AcctId>
			</Cur>
		</RsvatnId>
		<NewRsvatnValSet>
			<Amt>
				<AmtWthtCcy>0</AmtWthtCcy>
			</Amt>
		</NewRsvatnValSet>
	</ModfyRsvatn>
</Document>
